{
  "schema_version": "1.0",
  "artifact_type": "grade-4-live-catalogue-snapshot",
  "snapshot_id": "grade-4-live-catalogue-2026-07-27",
  "verified_on": "2026-07-27",
  "completeness_status": "complete_for_declared_filter",
  "catalogue_interface": {
    "url": "https://www.opiq.ee/Search/Kits?searchPhrase=&curriculumGroups=*&selectedkittype=*&classcourse=4&subject=&publishinghouse=&package=&language=&sortingorder=LanguageFirst",
    "capture_method": "public_varamu_filter_and_direct_kit_details_review",
    "selected_filters": {
      "search_phrase": "",
      "curriculum_or_programme": "all",
      "material_type": "all",
      "grade": "4. klass",
      "subject": "all",
      "publisher": "all",
      "package_or_access": "all",
      "language": "all",
      "sort_order": "LanguageFirst"
    },
    "pagination": {
      "pages_observed": 1,
      "all_result_pages_captured": true,
      "pagination_controls_present": false
    },
    "displayed_result_count": 55,
    "material_type_breakdown": {
      "learning_kits": 39,
      "teacher_books": 16
    },
    "stable_source_identity": {
      "filter_identity": {
        "algorithm": "sha256",
        "value": "ef472722fe673196b197e27b02df781febf1074cc4fd44666085ea4a49da6c5e",
        "identity_input": "filters_count_ordered_kit_ids"
      },
      "metadata_identity": {
        "algorithm": "sha256",
        "value": "45dd1857ebcd953a7a38d5634e2f8702f1d25e145021df08c002fd8585c6f4a0",
        "identity_input": "normalized_complete_record_metadata"
      }
    }
  },
  "evidence_sources": [
    {
      "evidence_ref": "catalogue-filter-grade-4-all",
      "evidence_type": "catalogue_filter_evidence",
      "url": "https://www.opiq.ee/Search/Kits?searchPhrase=&curriculumGroups=*&selectedkittype=*&classcourse=4&subject=&publishinghouse=&package=&language=&sortingorder=LanguageFirst",
      "verified_on": "2026-07-27",
      "note": "The public Grade 4 filter displayed 55 results on one page with no pagination controls."
    },
    {
      "evidence_ref": "direct-kit-details-all-55",
      "evidence_type": "direct_live_evidence",
      "url": "https://www.opiq.ee/Kit/Details/{kit_id}",
      "verified_on": "2026-07-27",
      "note": "All 55 public Kit Details pages were reviewed for structured metadata and counts."
    },
    {
      "evidence_ref": "repository-grade-4-capture",
      "evidence_type": "repository_capture_evidence",
      "url": null,
      "verified_on": "2026-07-27",
      "note": "The immutable ten-ZIP intake, post-intake evidence, canonical route policy, and source manifest were compared locally."
    },
    {
      "evidence_ref": "historical_post_audit_kit_details",
      "evidence_type": "manual_review_evidence",
      "url": null,
      "verified_on": "2026-07-27",
      "note": "Immutable evaluations/grade-4-kit-details-evidence.json records kit 55 as Grade 4 after the ZIP intake."
    },
    {
      "evidence_ref": "parallel_kit_82",
      "evidence_type": "derived_comparison",
      "url": "https://www.opiq.ee/Kit/Details/82",
      "verified_on": "2026-07-27",
      "note": "Russian parallel kit 82 is explicitly Grade 4 and remains routed with kit 55 in the mixed human/society source route."
    },
    {
      "evidence_ref": "project_decision_issue_41",
      "evidence_type": "manual_review_evidence",
      "url": "https://github.com/elvistudio/opiq-helper/issues/41",
      "verified_on": "2026-07-27",
      "note": "Project normalization decision for the Grade 4 catalogue audit; it does not alter the raw public observation."
    }
  ],
  "records": [
    {
      "kit_id": "71",
      "kit_details_url": "https://www.opiq.ee/Kit/Details/71",
      "verified_on": "2026-07-27",
      "capture_method": "direct_public_kit_details_and_catalogue_filter_review",
      "evidence_status": "direct_live_evidence",
      "title": "Eesti keel 4. klassile",
      "material_type": "Õppekomplekt",
      "subject": "Eesti keel",
      "grade_scope": {
        "observed": [
          4
        ]
      },
      "languages": [
        "Eesti keel"
      ],
      "publisher": "Avita",
      "authors": [
        "Kaja Sarapuu, Liisi Piits, Kristiina Orgla, Kati Lepp, Jaak Urmet, Lauri Vanamölder"
      ],
      "edition_or_year": null,
      "programme_or_support_role": "canonical_grade_4_student_source",
      "curriculum_labels": [
        "Riiklik õppekava 2011",
        "Riiklik õppekava 2023"
      ],
      "package_or_access": null,
      "chapter_count": 135,
      "task_count": 813,
      "textbook_task_count": 390,
      "task_collection_task_count": 423,
      "catalogue_filters": {
        "search_phrase": "",
        "curriculum_or_programme": "all",
        "material_type": "all",
        "grade": "4. klass",
        "subject": "all",
        "publisher": "all",
        "package_or_access": "all",
        "language": "all",
        "sort_order": "LanguageFirst"
      },
      "source_evidence_refs": [
        "catalogue-filter-grade-4-all",
        "direct-kit-details-all-55"
      ],
      "evidence_limitations": [
        "Public catalogue metadata and counts only; no chapter prose, task bodies, illustrations, answer keys, or authenticated content were captured."
      ],
      "primary_classification": "canonical_student_source",
      "secondary_roles": []
    },
    {
      "kit_id": "533",
      "kit_details_url": "https://www.opiq.ee/Kit/Details/533",
      "verified_on": "2026-07-27",
      "capture_method": "direct_public_kit_details_and_catalogue_filter_review",
      "evidence_status": "direct_live_evidence",
      "title": "Eesti keel 4. klassile 2024",
      "material_type": "Õppekomplekt",
      "subject": "Eesti keel",
      "grade_scope": {
        "observed": [
          4
        ]
      },
      "languages": [
        "Eesti keel"
      ],
      "publisher": "Avita",
      "authors": [
        "Kaja Sarapuu, Liisi Piits, Kristiina Orgla, Kati Lepp, Jaak Urmet, Lauri Vanamölder, Kärt Normann"
      ],
      "edition_or_year": "2024",
      "programme_or_support_role": "canonical_grade_4_student_source",
      "curriculum_labels": [
        "Riiklik õppekava 2023"
      ],
      "package_or_access": null,
      "chapter_count": 129,
      "task_count": 835,
      "textbook_task_count": 488,
      "task_collection_task_count": 347,
      "catalogue_filters": {
        "search_phrase": "",
        "curriculum_or_programme": "all",
        "material_type": "all",
        "grade": "4. klass",
        "subject": "all",
        "publisher": "all",
        "package_or_access": "all",
        "language": "all",
        "sort_order": "LanguageFirst"
      },
      "source_evidence_refs": [
        "catalogue-filter-grade-4-all",
        "direct-kit-details-all-55"
      ],
      "evidence_limitations": [
        "Public catalogue metadata and counts only; no chapter prose, task bodies, illustrations, answer keys, or authenticated content were captured."
      ],
      "primary_classification": "canonical_student_source",
      "secondary_roles": [
        "edition_or_replacement"
      ]
    },
    {
      "kit_id": "493",
      "kit_details_url": "https://www.opiq.ee/Kit/Details/493",
      "verified_on": "2026-07-27",
      "capture_method": "direct_public_kit_details_and_catalogue_filter_review",
      "evidence_status": "direct_live_evidence",
      "title": "Eesti keel 4. klassile, e-tund",
      "material_type": "Õpetajaraamat",
      "subject": "Eesti keel",
      "grade_scope": {
        "observed": [
          4
        ]
      },
      "languages": [
        "Eesti keel"
      ],
      "publisher": "Avita",
      "authors": [
        "Maire Aher, Terje Varul, Katrin Puik"
      ],
      "edition_or_year": null,
      "programme_or_support_role": "exact_grade_4_teacher_or_e_tund",
      "curriculum_labels": [
        "Riiklik õppekava 2011",
        "Riiklik õppekava 2023"
      ],
      "package_or_access": "—",
      "chapter_count": 177,
      "task_count": 0,
      "textbook_task_count": 0,
      "task_collection_task_count": 0,
      "catalogue_filters": {
        "search_phrase": "",
        "curriculum_or_programme": "all",
        "material_type": "all",
        "grade": "4. klass",
        "subject": "all",
        "publisher": "all",
        "package_or_access": "all",
        "language": "all",
        "sort_order": "LanguageFirst"
      },
      "source_evidence_refs": [
        "catalogue-filter-grade-4-all",
        "direct-kit-details-all-55"
      ],
      "evidence_limitations": [
        "Public catalogue metadata and counts only; no chapter prose, task bodies, illustrations, answer keys, or authenticated content were captured."
      ],
      "primary_classification": "teacher_only",
      "secondary_roles": [
        "edition_or_replacement",
        "teacher_support"
      ]
    },
    {
      "kit_id": "566",
      "kit_details_url": "https://www.opiq.ee/Kit/Details/566",
      "verified_on": "2026-07-27",
      "capture_method": "direct_public_kit_details_and_catalogue_filter_review",
      "evidence_status": "direct_live_evidence",
      "title": "Eesti keel 4. klassile, e-tund (2026)",
      "material_type": "Õpetajaraamat",
      "subject": "Eesti keel",
      "grade_scope": {
        "observed": [
          4
        ]
      },
      "languages": [
        "Eesti keel"
      ],
      "publisher": "Avita",
      "authors": [
        "Maire Aher, Terje Varul, Katrin Puik, Kärt Normann, Inga Kirs, Madli Kütt"
      ],
      "edition_or_year": "2026",
      "programme_or_support_role": "exact_grade_4_teacher_or_e_tund",
      "curriculum_labels": [
        "Riiklik õppekava 2023"
      ],
      "package_or_access": "—",
      "chapter_count": 178,
      "task_count": 1,
      "textbook_task_count": 1,
      "task_collection_task_count": 0,
      "catalogue_filters": {
        "search_phrase": "",
        "curriculum_or_programme": "all",
        "material_type": "all",
        "grade": "4. klass",